<?xml version="1.0"?>
<ecbdata 
xmlns="ecbdata.xsd" 
xsi:schemaLocation="ecbdata.xsd ecbdata.xsd"
xmlns:xsi="http://www.w3.org/2000/10/XMLSchema-instance">

<convertible>

<bond redemptionValue="100" currentPrice="104.999">
<maturity years="6" days="0"/>
<coupon rate="3.5" frequency="1"/>
<riskFreeRatePercent rate="5.25" compounding="semiAnnual"/>
<requiredYieldPercent rate="8.75" compounding="semiAnnual"/>
<!-- 
frequency is integer 
compounding choices are annual semiAnnual continuous
-->
</bond>

<stock 
currentPrice="8.19" 
countryDiscountPercent="15" 
volatilityPercent="30"
>
<dividends yieldPercent="1.5" yieldCompounding="annual">
<!--
<knownDiv amount="" year=""/>
-->
</dividends>
</stock>

<conversion conversionPrice="9.18" earliestConversion="0.5"/>
<!--
maturity of conversion option is by default equal to bond maturity 
unless the maturity attribute is set here to a different value
-->

<callProvisions ignore="false">
<call minTime="3.5" maxTime="6" minPrice="12.85" redemptionValue="100"/>
<call minTime="5.5" maxTime="6" minPrice="0" redemptionValue="100"/>
</callProvisions>


<putProvisions ignore="false">
<put minTime="5.5" maxTime="5.5" putValue="6" 
valueType="annualYieldPercent"/>
<!--
put value types are
continuousYieldPercent semiAnnualYieldPercent annualYieldPercent amount
-->
</putProvisions>

<currencyAppreciation dividends="0" coupons="0" redeem="0" 
 callPrice="0" callRedeem="0" putValue="0" compounding="continuous"/>

<computation 
numberOfLatticePoints="6" 
latticeDiscounting="probWeighted"
/>
<!--
latticeDiscounting choices are
riskFree bondYield probWeighted probAndValueWeighted
-->

<outputs
inputData="true"
latticeParameters="true"
fullLattice="true"
optionResults="true"
bondResults="true"
ytm="true"
outputInterestRateCompounding="semiAnnual"
vega="centralDifferences"
/>
<!--
the following default values apply unless set here explicitly
ytmToler="0.01"
maxIter="20"
-->
<!--
vega choices are
none forwardDifferences centralDifferences
-->

</convertible>
</ecbdata>
