<?xml version="1.0"?>
<ecbdata 
xmlns="ecbdata.xsd" 
xsi:schemaLocation="ecbdata.xsd ecbdata.xsd"
xmlns:xsi="http://www.w3.org/2001/XMLSchema-instance">

<convertible>

<bond redemptionValue="100" currentPrice="104.999">
<maturity years="3" days="0"/>
<coupon rate="2" frequency="1"/>
<riskFreeRatePercent rate="5" compounding="semiAnnual"/>
<requiredYieldPercent rate="10" compounding="semiAnnual"/>
<!-- 
frequency is integer 
compounding choices are annual semiAnnual continuous
-->
</bond>

<stock 
currentPrice="100" 
countryDiscountPercent="0" 
volatilityPercent="10"
>
<dividends yieldPercent="0" yieldCompounding="annual">
<!--
<knownDiv amount="" year=""/>
-->
</dividends>
</stock>

<conversion conversionPrice="100" earliestConversion="0"/>
<!--
maturity of conversion option is by default equal to bond maturity 
unless the maturity attribute is set here to a different value
-->

<callProvisions ignore="false">
<call minTime="1" maxTime="3" minPrice="115" redemptionValue="100"/>
</callProvisions>


<putProvisions ignore="false">
<put minTime="2" maxTime="2" putValue="95" 
valueType="amount"/>
<!--
put value types are
continuousYieldPercent semiAnnualYieldPercent annualYieldPercent amount
-->
</putProvisions>

<currencyAppreciation dividends="0" coupons="0" redeem="0" 
 callPrice="0" callRedeem="0" putValue="0" compounding="continuous"/>

<computation 
numberOfLatticePoints="3" 
/>

<outputs
inputData="true"
latticeParameters="true"
fullLattice="true"
optionResults="true"
bondResults="true"
ytm="true"
outputInterestRateCompounding="annual"
vega="none"
/>
<!--
the following default values apply unless set here explicitly
ytmToler="0.01"
maxIter="20"
-->
<!--
vega choices are
none forwardDifferences centralDifferences
-->

</convertible>
</ecbdata>
